{
  "tc_id": "TC-009",
  "tc_title": "Safety Signal Evaluation and DMC Report",
  "level": 3,
  "study_design": {
    "n_subjects": 400,
    "n_per_arm": {
      "Active": 200,
      "Placebo": 200
    },
    "total_patient_years": {
      "Active": 207.5569,
      "Placebo": 215.5697
    },
    "arms": [
      "Active",
      "Placebo"
    ]
  },
  "ae_overview": {
    "by_arm": {
      "Active": {
        "n": 200,
        "n_any_ae": 200,
        "pct_any_ae": 100.0,
        "n_sae": 98,
        "pct_sae": 49.0,
        "n_disc": 55,
        "pct_disc": 27.5,
        "n_died": 17,
        "pct_died": 8.5,
        "total_ae_reports": 1037
      },
      "Placebo": {
        "n": 200,
        "n_any_ae": 194,
        "pct_any_ae": 97.0,
        "n_sae": 74,
        "pct_sae": 37.0,
        "n_disc": 44,
        "pct_disc": 22.0,
        "n_died": 21,
        "pct_died": 10.5,
        "total_ae_reports": 609
      }
    },
    "risk_difference": {
      "any_ae": {
        "rd": 0.03,
        "ci_lower": 0.0064,
        "ci_upper": 0.0536,
        "fisher_p": 0.030084
      },
      "sae": {
        "rd": 0.12,
        "ci_lower": 0.0237,
        "ci_upper": 0.2163,
        "fisher_p": 0.020062
      },
      "discontinuation": {
        "rd": 0.055,
        "ci_lower": -0.0294,
        "ci_upper": 0.1394,
        "fisher_p": 0.246549
      },
      "death": {
        "rd": -0.02,
        "ci_lower": -0.0774,
        "ci_upper": 0.0374,
        "fisher_p": 0.609456
      }
    }
  },
  "exposure_adjusted": {
    "total_patient_years": {
      "Active": 207.5569,
      "Placebo": 215.5697
    },
    "ae_per_100py": {
      "Active": 499.62,
      "Placebo": 282.51
    },
    "sae_per_100py": {
      "Active": 65.52,
      "Placebo": 39.89
    },
    "common_pts": {
      "Acute kidney injury": {
        "pt": "Acute kidney injury",
        "n_active": 12,
        "n_placebo": 6,
        "rate_per_100py_active": 5.78,
        "rate_per_100py_placebo": 2.78,
        "rd_per_100py": 3.0,
        "rd_pct_ci_lower": -0.0105,
        "rd_pct_ci_upper": 0.0705
      },
      "Alanine aminotransferase increased": {
        "pt": "Alanine aminotransferase increased",
        "n_active": 49,
        "n_placebo": 24,
        "rate_per_100py_active": 23.61,
        "rate_per_100py_placebo": 11.13,
        "rd_per_100py": 12.48,
        "rd_pct_ci_lower": 0.0503,
        "rd_pct_ci_upper": 0.1997
      },
      "Anaemia": {
        "pt": "Anaemia",
        "n_active": 51,
        "n_placebo": 29,
        "rate_per_100py_active": 24.57,
        "rate_per_100py_placebo": 13.45,
        "rd_per_100py": 11.12,
        "rd_pct_ci_lower": 0.0323,
        "rd_pct_ci_upper": 0.1877
      },
      "Aspartate aminotransferase increased": {
        "pt": "Aspartate aminotransferase increased",
        "n_active": 46,
        "n_placebo": 23,
        "rate_per_100py_active": 22.16,
        "rate_per_100py_placebo": 10.67,
        "rd_per_100py": 11.49,
        "rd_pct_ci_lower": 0.0418,
        "rd_pct_ci_upper": 0.1882
      },
      "Atrial fibrillation": {
        "pt": "Atrial fibrillation",
        "n_active": 10,
        "n_placebo": 8,
        "rate_per_100py_active": 4.82,
        "rate_per_100py_placebo": 3.71,
        "rd_per_100py": 1.11,
        "rd_pct_ci_lower": -0.0306,
        "rd_pct_ci_upper": 0.0506
      },
      "Blood bilirubin increased": {
        "pt": "Blood bilirubin increased",
        "n_active": 25,
        "n_placebo": 14,
        "rate_per_100py_active": 12.04,
        "rate_per_100py_placebo": 6.49,
        "rd_per_100py": 5.55,
        "rd_pct_ci_lower": -0.0029,
        "rd_pct_ci_upper": 0.1129
      },
      "Cough": {
        "pt": "Cough",
        "n_active": 34,
        "n_placebo": 27,
        "rate_per_100py_active": 16.38,
        "rate_per_100py_placebo": 12.52,
        "rd_per_100py": 3.86,
        "rd_pct_ci_lower": -0.0354,
        "rd_pct_ci_upper": 0.1054
      },
      "Death": {
        "pt": "Death",
        "n_active": 16,
        "n_placebo": 21,
        "rate_per_100py_active": 7.71,
        "rate_per_100py_placebo": 9.74,
        "rd_per_100py": -2.03,
        "rd_pct_ci_lower": -0.0817,
        "rd_pct_ci_upper": 0.0317
      },
      "Decreased appetite": {
        "pt": "Decreased appetite",
        "n_active": 56,
        "n_placebo": 45,
        "rate_per_100py_active": 26.98,
        "rate_per_100py_placebo": 20.87,
        "rd_per_100py": 6.11,
        "rd_pct_ci_lower": -0.03,
        "rd_pct_ci_upper": 0.14
      },
      "Diarrhoea": {
        "pt": "Diarrhoea",
        "n_active": 81,
        "n_placebo": 44,
        "rate_per_100py_active": 39.03,
        "rate_per_100py_placebo": 20.41,
        "rd_per_100py": 18.62,
        "rd_pct_ci_lower": 0.096,
        "rd_pct_ci_upper": 0.274
      },
      "Drug-induced liver injury": {
        "pt": "Drug-induced liver injury",
        "n_active": 12,
        "n_placebo": 3,
        "rate_per_100py_active": 5.78,
        "rate_per_100py_placebo": 1.39,
        "rd_per_100py": 4.39,
        "rd_pct_ci_lower": 0.008,
        "rd_pct_ci_upper": 0.082
      },
      "Fatigue": {
        "pt": "Fatigue",
        "n_active": 104,
        "n_placebo": 62,
        "rate_per_100py_active": 50.11,
        "rate_per_100py_placebo": 28.76,
        "rd_per_100py": 21.35,
        "rd_pct_ci_lower": 0.1156,
        "rd_pct_ci_upper": 0.3044
      },
      "Headache": {
        "pt": "Headache",
        "n_active": 42,
        "n_placebo": 44,
        "rate_per_100py_active": 20.24,
        "rate_per_100py_placebo": 20.41,
        "rd_per_100py": -0.17,
        "rd_pct_ci_lower": -0.0905,
        "rd_pct_ci_upper": 0.0705
      },
      "Hypothyroidism": {
        "pt": "Hypothyroidism",
        "n_active": 27,
        "n_placebo": 13,
        "rate_per_100py_active": 13.01,
        "rate_per_100py_placebo": 6.03,
        "rd_per_100py": 6.98,
        "rd_pct_ci_lower": 0.0116,
        "rd_pct_ci_upper": 0.1284
      },
      "Nausea": {
        "pt": "Nausea",
        "n_active": 102,
        "n_placebo": 64,
        "rate_per_100py_active": 49.14,
        "rate_per_100py_placebo": 29.69,
        "rd_per_100py": 19.45,
        "rd_pct_ci_lower": 0.0952,
        "rd_pct_ci_upper": 0.2848
      },
      "Neutropenia": {
        "pt": "Neutropenia",
        "n_active": 51,
        "n_placebo": 25,
        "rate_per_100py_active": 24.57,
        "rate_per_100py_placebo": 11.6,
        "rd_per_100py": 12.97,
        "rd_pct_ci_lower": 0.0542,
        "rd_pct_ci_upper": 0.2058
      },
      "Peripheral neuropathy": {
        "pt": "Peripheral neuropathy",
        "n_active": 31,
        "n_placebo": 13,
        "rate_per_100py_active": 14.94,
        "rate_per_100py_placebo": 6.03,
        "rd_per_100py": 8.91,
        "rd_pct_ci_lower": 0.0293,
        "rd_pct_ci_upper": 0.1507
      },
      "Pruritus": {
        "pt": "Pruritus",
        "n_active": 61,
        "n_placebo": 21,
        "rate_per_100py_active": 29.39,
        "rate_per_100py_placebo": 9.74,
        "rd_per_100py": 19.65,
        "rd_pct_ci_lower": 0.1233,
        "rd_pct_ci_upper": 0.2767
      },
      "Pyrexia": {
        "pt": "Pyrexia",
        "n_active": 40,
        "n_placebo": 32,
        "rate_per_100py_active": 19.27,
        "rate_per_100py_placebo": 14.84,
        "rd_per_100py": 4.43,
        "rd_pct_ci_lower": -0.0352,
        "rd_pct_ci_upper": 0.1152
      },
      "QT prolongation": {
        "pt": "QT prolongation",
        "n_active": 15,
        "n_placebo": 3,
        "rate_per_100py_active": 7.23,
        "rate_per_100py_placebo": 1.39,
        "rd_per_100py": 5.84,
        "rd_pct_ci_lower": 0.0198,
        "rd_pct_ci_upper": 0.1002
      },
      "Rash": {
        "pt": "Rash",
        "n_active": 81,
        "n_placebo": 32,
        "rate_per_100py_active": 39.03,
        "rate_per_100py_placebo": 14.84,
        "rd_per_100py": 24.19,
        "rd_pct_ci_lower": 0.1601,
        "rd_pct_ci_upper": 0.3299
      },
      "Thrombocytopenia": {
        "pt": "Thrombocytopenia",
        "n_active": 38,
        "n_placebo": 25,
        "rate_per_100py_active": 18.31,
        "rate_per_100py_placebo": 11.6,
        "rd_per_100py": 6.71,
        "rd_pct_ci_lower": -0.0061,
        "rd_pct_ci_upper": 0.1361
      },
      "Vomiting": {
        "pt": "Vomiting",
        "n_active": 53,
        "n_placebo": 31,
        "rate_per_100py_active": 25.54,
        "rate_per_100py_placebo": 14.38,
        "rd_per_100py": 11.16,
        "rd_pct_ci_lower": 0.0309,
        "rd_pct_ci_upper": 0.1891
      }
    }
  },
  "grade3_plus": {
    "by_arm": {
      "Active": {
        "n": 138,
        "pct": 69.0
      },
      "Placebo": {
        "n": 97,
        "pct": 48.5
      }
    },
    "risk_difference": 0.205,
    "rd_ci": {
      "lower": 0.1106,
      "upper": 0.2994
    },
    "fisher_p": 4.5e-05,
    "top_pts": {
      "Acute kidney injury": {
        "pt": "Acute kidney injury",
        "n_active": 8,
        "n_placebo": 3,
        "rd": 0.025,
        "ci_lower": -0.007,
        "ci_upper": 0.057
      },
      "Alanine aminotransferase increased": {
        "pt": "Alanine aminotransferase increased",
        "n_active": 6,
        "n_placebo": 5,
        "rd": 0.005,
        "ci_lower": -0.027,
        "ci_upper": 0.037
      },
      "Anaemia": {
        "pt": "Anaemia",
        "n_active": 21,
        "n_placebo": 6,
        "rd": 0.075,
        "ci_lower": 0.0264,
        "ci_upper": 0.1236
      },
      "Aspartate aminotransferase increased": {
        "pt": "Aspartate aminotransferase increased",
        "n_active": 8,
        "n_placebo": 5,
        "rd": 0.015,
        "ci_lower": -0.0197,
        "ci_upper": 0.0497
      },
      "Atrial fibrillation": {
        "pt": "Atrial fibrillation",
        "n_active": 2,
        "n_placebo": 5,
        "rd": -0.015,
        "ci_lower": -0.0407,
        "ci_upper": 0.0107
      },